user_input,retrieved_contexts,response,faithfulness,answer_relevancy,version
What is creatine used for beyond muscle building?,"['[Doc 1 — Body Recomposition Research | topic: nutrition]\nacute caffeine ingestion prior to exercise is unaffected by\ncreatine when a prior creatine loading protocol had been\ncompleted by participants [ 394, 395]. However, there is\nsome ambiguity with regard to the co-ingestion of caf-\nfeine during a creatine-loading phase (e.g., co-ingestion\nof coffee and creatine) [ 396– 399]. Studies available to\ndate suggest that high-dose chronic caffeine (> 9 mg/kg)\nand creatine co-ingestion should be employed cau-\ntiously, as counteracting mechanisms on Ca2+ clearance\nand release, and muscle relaxation time have been hy-\n\n[Doc 2 — Protein & Nutrient Timing | topic: nutrition]\nis less established.\n/C15Rapid ingestion of high amounts of carbohydrates\n(≥ 1.2 g/kg/h) for four to 6 h soon after exhausting\nexercise can rapidly stimulate replenishment of\nmuscle glycogen.\n/C15Adding protein (0.2 –0.5 g/kg/h) to carbohydrate\nincreases the rate of glycogen resynthesis when\ningesting < 1.2 g/kg/h of carbohydrate. Moreover,\nthe additional protein may minimize muscle\ndamage, promote favorable hormone balance and\naccelerate recovery from intense exercise.\n/C15For athletes completing high volumes (i.e., ≥ 8h )o f\nexercise per week and subsequently requiring the\n\n[Doc 3 — Protein & Nutrient Timing | topic: nutrition]\nbegan with high muscle glycogen levels, and even greater\npower was achieved when carbohydrate was frequently\nprovided throughout the exercise protocol. A similar\noutcome was demonstrated by Febbraio and colleagues\n[54] where they required participants to complete four\nKerksick et al. Journal of the International Society of Sports Nutrition (2017) 14:33 Page 4 of 21\n\n[Doc 4 — Protein & Nutrient Timing | topic: nutrition]\n27. Van Loon L, Saris WH, Kruijshoop M. Maximizing Postexercise Muscle Glycogen\nSynthesis: Carbohydrate Supplementation And The Application Of Amino Acid\nOr Protein Hydrolysate Mixtures. Am J Clin Nutr. 2000;72:106–11.\n28. Riddell MC, Partington SL, Stupka N, Armstrong D, Rennie C, Tarnopolsky\nMA. Substrate Utilization During Exercise Performed With And Without\nGlucose Ingestion In Female And Male Endurance Trained Athletes. Int J\nSport Nutr Exerc Metab. 2003;13(4):407 –21.\n29. Devries MC, Hamadeh MJ, Phillips SM, Tarnopolsky MA. Menstrual Cycle\n\n[Doc 5 — Body Recomposition Research | topic: nutrition]\nHigh rates of muscle glycogen resynthesis after exhaustive exercise when\ncarbohydrate is coingested with caffeine. J Appl Physiol. 2008;105(1):7 –13.\n414. Beelen M, Kranenburg J, Senden JM, Kuipers H, Loon LJ. Impact of caffeine\nand protein on postexercise muscle glycogen synthesis. Med Sci Sports\nExerc. 2012;44(4):692 –700.\n415. Taylor C, Higham D, Close GL, Morton JP. The effect of adding caffeine to\npostexercise carbohydrate feeding on subsequent high-intensity interval-\nrunning capacity compared with carbohydrate alone. Int J Sport Nutr Exerc\nMetab. 2011;21(5):410 –6.']",I don't have enough research in my knowledge base to answer that specifically.,0.0,0.0,v1_dense_only
How long does it actually take to build a habit?,"['[Doc 1 — Atomic Habits | topic: habit]\nduring the first days, weeks, and even months. It doesn’t feel like you are going\nanywhere. It’s a hallmark of any compounding process: the most powerful\noutcomes are delayed.\nThis is one of the core reasons why it is so hard to build habits that \nlast.\nPeople make a few small changes, fail to see a tangible result, and decide to stop.\nYou think, “I’ve been running every day for a month, so why can’t I see any\nchange in my body?” Once this kind of thinking takes over, it’s easy to let good\nhabits fall by the wayside. But in order to make a meaningful difference, habits\n\n[Doc 2 — Atomic Habits | topic: habit]\nFIGURE 7: Habit stacking increases the likelihood that you’ll stick with a habit by stacking your new behavior on top of an old one. This process can be repeated to chain numerous habits\ntogether, each one acting as the cue for the next.\nYour morning routine habit stack might look like this:\n1. \nAfter I pour my morning cup of coffee, I will meditate for sixty\nseconds.\n2. \nAfter I meditate for sixty seconds, I will write my to-do list for the\nday.\n3. \nAfter I write my to-do list for the day, I will immediately begin my\nfirst task.\nOr, consider this habit stack in the evening:\n\n[Doc 3 — Atomic Habits | topic: habit]\nChapter Summary\nThe 3rd Law of Behavior Change is \nmake it easy\n.\nThe most effective form of learning is practice, not planning.\nFocus on taking action, not being in motion.\nHabit formation is the process by which a behavior becomes\nprogressively more automatic through repetition.\nThe amount of time you have been performing a habit is not as\nimportant as the number of times you have performed it.\n\n[Doc 4 — Atomic Habits | topic: habit]\nHabits Scorecard, \n64\n–66\nhabit stacking, \n74\n–79, \n110\n–11\nhabit tracking, \n197\nimplementation intention, \n69\n–72\nmaking the cues of bad habits invisible, \n94\n–95\nFisher, Roger, \n205\n–206\nflow state, \n224\n–33\nFogg, BJ, \n72\n74\nfood science\n“bliss point” for each product, \ncravings for junk food, \n102\n–103\ndynamic contrast of processed foods, \norosensation, \nfour laws of behavior change, \n53\n–55, \n186\n252\n–53. \nSee also\n specific numbered laws\nfour-step process of building a habit\n1. cue, \n47\n–48\n2. craving, \n48\n3. response, \n48\n–49\n4. reward, \nhabit loop, \nlessons from, \n259\n–64\n\n[Doc 5 — Atomic Habits | topic: habit]\nfeels exhausting. Meanwhile, sticking to the habit of doing one push-up per day\nrequires almost no energy to get started. And the less energy a habit requires, the\nmore likely it is to occur.\nLook at any behavior that fills up much of your life and you’ll see that it can\nbe performed with very low levels of motivation. Habits like scrolling on our\nphones, checking email, and watching television steal so much of our time\nbecause they can be performed almost without effort. They are remarkably\nconvenient.\nIn a sense, every habit is just an obstacle to getting what you really want.']",I don't have enough research in my knowledge base to answer that specifically.,0.0,0.0,v1_dense_only
What is the habit loop and how do I use it to build better routines?,"['[Doc 1 — Atomic Habits | topic: habit]\nFIGURE 7: Habit stacking increases the likelihood that you’ll stick with a habit by stacking your new behavior on top of an old one. This process can be repeated to chain numerous habits\ntogether, each one acting as the cue for the next.\nYour morning routine habit stack might look like this:\n1. \nAfter I pour my morning cup of coffee, I will meditate for sixty\nseconds.\n2. \nAfter I meditate for sixty seconds, I will write my to-do list for the\nday.\n3. \nAfter I write my to-do list for the day, I will immediately begin my\nfirst task.\nOr, consider this habit stack in the evening:\n\n[Doc 2 — Atomic Habits | topic: habit]\nHabits Scorecard, \n64\n–66\nhabit stacking, \n74\n–79, \n110\n–11\nhabit tracking, \n197\nimplementation intention, \n69\n–72\nmaking the cues of bad habits invisible, \n94\n–95\nFisher, Roger, \n205\n–206\nflow state, \n224\n–33\nFogg, BJ, \n72\n74\nfood science\n“bliss point” for each product, \ncravings for junk food, \n102\n–103\ndynamic contrast of processed foods, \norosensation, \nfour laws of behavior change, \n53\n–55, \n186\n252\n–53. \nSee also\n specific numbered laws\nfour-step process of building a habit\n1. cue, \n47\n–48\n2. craving, \n48\n3. response, \n48\n–49\n4. reward, \nhabit loop, \nlessons from, \n259\n–64\n\n[Doc 3 — Atomic Habits | topic: habit]\nduring the first days, weeks, and even months. It doesn’t feel like you are going\nanywhere. It’s a hallmark of any compounding process: the most powerful\noutcomes are delayed.\nThis is one of the core reasons why it is so hard to build habits that \nlast.\nPeople make a few small changes, fail to see a tangible result, and decide to stop.\nYou think, “I’ve been running every day for a month, so why can’t I see any\nchange in my body?” Once this kind of thinking takes over, it’s easy to let good\nhabits fall by the wayside. But in order to make a meaningful difference, habits\n\n[Doc 4 — Atomic Habits | topic: habit]\npathway, than this difficulty vanishes; \nthe actions become so automatic that they\ncan be performed while the mind is otherwise engaged.” Both common sense\nand scientific evidence agree: \nrepetition is a form of change.\nEach time you repeat an action, you are activating a particular neural circuit\nassociated with that habit. This means that simply putting in your reps is one of\nthe most critical steps you can take to encoding a new habit. It is why the\nstudents who took tons of photos improved their skills while those who merely\n\n[Doc 5 — Atomic Habits | topic: habit]\nChapter Summary\nThe 3rd Law of Behavior Change is \nmake it easy\n.\nThe most effective form of learning is practice, not planning.\nFocus on taking action, not being in motion.\nHabit formation is the process by which a behavior becomes\nprogressively more automatic through repetition.\nThe amount of time you have been performing a habit is not as\nimportant as the number of times you have performed it.']",I don't have enough research in my knowledge base to answer that specifically.,0.0,0.0,v1_dense_only
What is GTD methodology and how does it reduce mental load?,"['[Doc 1 — Getting Things Done (GTD) | topic: habit]\nleaving nothing on your mind other than what’s present in the moment.\nConclusion\nI hope this book has been useful—that you have started to reap the rewards\nof getting more done with less effort and stress. And I really hope you have\ntasted the freedom of a “mind like water” and the release of your creative\nenergies that can be the result of the application of these techniques. Those\nwho begin to implement GTD methods always discover there’s more here\nthan meets the eye, and you may have already begun to experience your own\nversion of that.\n\n[Doc 2 — Getting Things Done (GTD) | topic: habit]\nget!” The more confidence you have that you can actually manifest things\nbefore you have all the knowledge and resources you might need, the more\nyou can potentially overwhelm yourself with your own possibilities. So the\nclarity and confidence that your GTD practices allow simultaneously\ndemand their ongoing utilization.\n*We’re available. Visit www.gettingthingsdone.com anytime for tons of free\nsupport material, conversations and stories about these best practices from\npeople like you, current information about supportive products and services,\n\n[Doc 3 — Getting Things Done (GTD) | topic: habit]\nbank; and you can quickly create a rich context for a family conversation\nabout plans for the next two years. You have a dynamic, working dashboard\nthat serves your orientation for virtually any context, whether at home, at the\noffice, or in transit, seamlessly.\nPressure Produces Greater Rather Than Reduced Utilization of These\nPractices\nOne of the most common observations I hear from people who have at some\npoint bought into the GTD process but have not progressed particularly far\nwith it is that they fell away from it because they had an intense series of\n\n[Doc 4 — Getting Things Done (GTD) | topic: habit]\nChapter 5: Capturing: Corralling Your “Stuff”\nChapter 6: Clarifying: Getting “In” to Empty\nChapter 7: Organizing: Setting Up the Right Buckets\nChapter 8: Reflecting: Keeping It All Fresh and Functional\nChapter 9: Engaging: Making the Best Action Choices\nChapter 10: Getting Projects Under Control\npart 3: The Power of the Key Principles\nChapter 11: The Power of the Capturing Habit\nChapter 12: The Power of the Next-Action Decision\nChapter 13: The Power of Outcome Focusing\nChapter 14: GTD and Cognitive Science\nChapter 15: The Path of GTD Mastery\nConclusion\nAppendix\n\n[Doc 5 — Getting Things Done (GTD) | topic: habit]\nGTD and Positive Psychology\nIn 2000 Martin Seligman took on the presidency of the American\nPsychological Association. For his presidential address he challenged the\nprofession to shift its focus away from simply describing, studying, and\ndiagnosing the negative aspects of the human condition and to begin\ndevoting more attention to the positive aspects of what it means to be\nhuman. Of course, his message was simply a more mainstream embodiment\nof Abraham Maslow’s ideas from the mid-twentieth century of personal\nfulfillment as the richest arena of psychology.']",I don't have enough research in my knowledge base to answer that specifically.,0.0,0.0,v1_dense_only
How does deep work differ from regular work and why does it matter?,"['[Doc 1 — Deep Work | topic: focus]\nsee the goal of this rule as taming shallow work’s footprint in your schedule, not\neliminating it.\nThen there’s the issue of cognitive capacity. Deep work is exhausting because it\npushes you toward the limit of your abilities. Performance psychologists have\nextensively studied how much such efforts can be sustained by an individual in a given\nday.\n*\n In their seminal paper on deliberate practice, Anders Ericsson and his\ncollaborators survey these studies. They note that for someone new to such practice\n\n[Doc 2 — Deep Work | topic: focus]\nexample highlights a general warning about this selection: You must be careful to\nchoose a philosophy that fits your specific circumstances, as a mismatch here can\nderail your deep work habit before it has a chance to solidify. This strategy will help\nyou avoid this fate by presenting four different depth philosophies that I’ve seen work\nexceptionally well in practice. The goal is to convince you that there are many\ndifferent ways to integrate deep work into your schedule, and it’s therefore worth\ntaking the time to find an approach that makes sense for you.\n\n[Doc 3 — Deep Work | topic: focus]\nDon’t Work Alone\nThe relationship between deep work and collaboration is tricky. It’s worth taking the\ntime to untangle, however, because properly leveraging collaboration can increase the\nquality of deep work in your professional life.\nIt’s helpful to start our discussion of this topic by taking a step back to consider\nwhat at first seems to be an unresolvable conflict. In Part 1 of this book I criticized\nFacebook for the design of its new headquarters. In particular, I noted that the\ncompany’s goal to create the world’s largest open office space—a giant room that\n\n[Doc 4 — Deep Work | topic: focus]\nmore value produced as compared to longer but less organized schedules.\nThe key claim of this strategy is that these same benefits \nhold for most knowledge\nwork fields. That is, even if you’re not a professor, fixed-schedule productivity can\nyield powerful benefits. In most knowledge work jobs, it can be difficult in the\nmoment to turn down a shallow commitment that seems harmless in isolation—be it\naccepting an invitation to get coffee or agreeing to “jump on a call.” A commitment to\nfixed-schedule productivity, however, shifts you into a scarcity mind-set. Suddenly\n\n[Doc 5 — Deep Work | topic: focus]\neconomy as it so clearly does in a craft economy. In the sections ahead, I’ll make three\narguments to support this claim. These arguments roughly follow a trajectory from the\nconceptually narrow to broad: starting with a neurological perspective, moving to the\npsychological, and ending with the philosophical. I’ll show that regardless of the\nangle from which you attack the issue of depth and knowledge work, it’s clear that by\nembracing depth over shallowness \nyou can tap the same veins of meaning that drive']",I don't have enough research in my knowledge base to answer that specifically.,0.0,0.0,v1_dense_only
What is the Pomodoro Technique and what does research say about it?,"['[Doc 1 — Flow State & Intrinsic Motivation | topic: motivation]\nponents are not distinguished from what is essential, the path to freedom\ngets overgrown by brambles of meaningless mumbo jumbo. Ritual form\nwins over substance, and the seeker is back where he started.\nControl over consciousness cannot be institutionalized. As soon as it\nbecomes part of a set of social rules and norms, it ceases to be effective in\nthe way it was originally intended to be. Routinization, unfortunately,\ntends to take place very rapidly. Freud was still alive when his quest for\nliberating the ego from its oppressors was turned into a staid ideology and\n\n[Doc 2 — Deep Work | topic: focus]\n:\na phenomenal output for someone who also worked a nine-to-five job. “Who’s to say\nthat I can’t be that prolific?” he concluded. “Why not me?”\nThe rhythmic philosophy provides an interesting contrast to the bimodal\nphilosophy. It perhaps fails to achieve the most intense levels of deep thinking sought\nin the daylong concentration sessions favored by the bimodalist. The trade-off,\nhowever, is that this approach works better with the reality of human nature. By\nsupporting deep work with rock-solid routines that make sure a little bit gets done on a\n\n[Doc 3 — Atomic Habits | topic: habit]\nGail B. Peterson, “A Day of Great Illumination: B. F. Skinner’s Discovery of Shaping,” \nJournal of the Experimental Analysis of Behavior\n 82, no. 3 (2004), doi:10.1901/jeab.2004.82–317.\n\n[Doc 4 — Flow State & Intrinsic Motivation | topic: motivation]\nBut flow is not just an academic subject. Only a few years after it was\nfirst published, the theory began to be applied to a variety of practical issues.\nWhenever the goal is to improve the quality of life, the flow theory can\npoint the way. It has inspired the creation of experimental school curricula,\nthe training of business executives, the design of leisure products and ser-\nvices. Flow is being used to generate ideas and practices in clinical psycho-\ntherapy, the rehabilitation of juvenile delinquents, the organization of\n\n[Doc 5 — Flow State & Intrinsic Motivation | topic: motivation]\nway to ensure that the body will get the nourishment it needs. The pleasure\nof sexual intercourse is an equally practical method for the genes to program\nthe body to reproduce and thereby to ensure the continuity of the genes.\nWhen a man is physically attracted to a woman, or vice versa, he usually\nimagines—assuming that he thinks about it at all—that this desire is an\nexpression of his own individual interests, a result of his own intentions.\nIn reality, more often than not his interest is simply being manipulated by\nthe invisible genetic code,\nMihaly Csikszentmihalyi / 17']",I don't have enough research in my knowledge base to answer that specifically.,0.0,0.0,v1_dense_only
How should I structure my time blocks for maximum deep work output?,"['[Doc 1 — Deep Work | topic: focus]\nsee the goal of this rule as taming shallow work’s footprint in your schedule, not\neliminating it.\nThen there’s the issue of cognitive capacity. Deep work is exhausting because it\npushes you toward the limit of your abilities. Performance psychologists have\nextensively studied how much such efforts can be sustained by an individual in a given\nday.\n*\n In their seminal paper on deliberate practice, Anders Ericsson and his\ncollaborators survey these studies. They note that for someone new to such practice\n\n[Doc 2 — CBT for Procrastination | topic: procrastination]\n• When contemplating how to do a task, there are numerous ways you can approach any given task to \nmake the task easier. Some of the methods you might try include, worst-first, using momentum, just 5-\nminutes, set time limits, prime time, prime place, remember-then-do, reminders, visualise, focus, and \nplan rewards. \n• To manage your time availability, so that you know when to do your tasks and goals, you can use a \nmore fixed method like the schedule (i.e., planning specific tasks for specific times in your week) or a\n\n[Doc 3 — Deep Work | topic: focus]\ncorresponding to the hour where I finished the result.\n*\n This served two purposes.\nFirst, it allowed me to connect, at a visceral level, accumulated deep work hours and\n\n[Doc 4 — CBT for Procrastination | topic: procrastination]\nsomething similar in a notebook, focusing particularly on the tasks or goals you have decided to tackle \nthroughout these Modules. \nPrioritise Week’s Tasks \nRing family member \uf0ac \nFin\nish ‘Put Off Procrastinating’ Modules \nP\nay gas bill \uf0ac \nT\nidy spare room for guests \nS\ntart a walking exercise routine \nGrade & Time Tasks \nPay gas bill: \n1. Find account (5 mins)\n2. Ring company & pay over phone (5 mins)\nF\ninish ‘Put Off Procrastinating’ Modules: \n1. Complete Module 5 (2 hours)\n2. Write outline for Module 6 (1 hour)\n3. Write Module 6 (5 hours)\n4. Write outline for Module 7 (1 hour)\n\n[Doc 5 — Deep Work | topic: focus]\nexample highlights a general warning about this selection: You must be careful to\nchoose a philosophy that fits your specific circumstances, as a mismatch here can\nderail your deep work habit before it has a chance to solidify. This strategy will help\nyou avoid this fate by presenting four different depth philosophies that I’ve seen work\nexceptionally well in practice. The goal is to convince you that there are many\ndifferent ways to integrate deep work into your schedule, and it’s therefore worth\ntaking the time to find an approach that makes sense for you.']",I don't have enough research in my knowledge base to answer that specifically.,0.0,0.0,v1_dense_only
What does flow state research say about how to get into flow?,"['[Doc 1 — Flow State & Intrinsic Motivation | topic: motivation]\nsections of experience have been collected from different parts of the world.\nThe conclusions of this volume are based on that body of data.\nThe study of flow I began at the University of Chicago has now spread\nworldwide. Researchers in Canada, Germany, Italy, Japan, and Australia\nhave taken up its investigation. At present the most extensive collection of\ndata outside of Chicago is at the Institute of Psychology of\n4 / Flow\n\n[Doc 2 — Flow State & Intrinsic Motivation | topic: motivation]\nBut flow is not just an academic subject. Only a few years after it was\nfirst published, the theory began to be applied to a variety of practical issues.\nWhenever the goal is to improve the quality of life, the flow theory can\npoint the way. It has inspired the creation of experimental school curricula,\nthe training of business executives, the design of leisure products and ser-\nvices. Flow is being used to generate ideas and practices in clinical psycho-\ntherapy, the rehabilitation of juvenile delinquents, the organization of\n\n[Doc 3 — Flow State & Intrinsic Motivation | topic: motivation]\nof defining flow is rather liberal. If one only wished to include extremely\ncomplex flow experiences—say, those with the highest levels of challenges\nand skills—perhaps fewer than 1 percent of the responses would qualify\nas flow. The methodological convention adopted here to define flow\nfunctions somewhat like a microscope: depending on the level of magnific-\nation used, very different detail will be visible.\nAs expected, the more time a person spent in flow during the week, the\nbetter was the overall quality of his or her reported experience. People who\n\n[Doc 4 — Flow State & Intrinsic Motivation | topic: motivation]\nFlow. My work on optimal experience began with my doctoral dissertation,\nwhich involved a study of how young artists went about creating a painting.\nSome of the results were reported in the book The Creative Vision (Getzels\n& Csikszentmihalyi 1976). Since then several dozen scholarly articles have\nappeared on the subject. The first book that described the flow experience\ndirectly was Beyond Boredom and Anxiety (Csikszentmihalyi 1975). The latest\nsummary of the academic research on the flow experience was collected\nin the edited volume Optimal Experience: Psychological Studies of Flow in\n\n[Doc 5 — Flow State & Intrinsic Motivation | topic: motivation]\n25(4):79–89.\n——. 1988. Flow in solitary ordeals. In M. Csikszentmihalyi & I. S. Csikszentmihalyi,\neds., Optimal experience: Psychological studies of flow in consciousness (pp. 172–80). New\nYork: Cambridge University Press.\nLumdsen, C. J., & Wilson, E. O. 1981. Genes, mind, culture: The coevolutionary process.\nCambridge: Harvard University Press.\n——. 1983. Promethean fire: Reflections on the origin of mind. Cambridge: Harvard University\nPress.\nLumholtz, C. 1902 (1987). Unknown Mexico, vol. 1. New York: Dover Publications.']",I don't have enough research in my knowledge base to answer that specifically.,0.0,0.0,v1_dense_only
