user_input,retrieved_contexts,response,faithfulness,answer_relevancy,version
Why do I procrastinate even on things I genuinely care about?,"['[Doc 1 — CBT for Procrastination | topic: procrastination]\ntime” or “I don’t deserve rewards or fun”. But think of it this way, the things you don’t like doing tend to \nzap some of your energy, whereas rewards, leisure and pleasure help replenish you energy, allowing you to \ndo better quality work in the long run. It is all about a balance between pleasure and achievement. When \nyou are a procrastinator the balance is out, in that there is more pleasure (often guilty pleasure) and little \nachievement. The aim with overcoming procrastination is not for it to be all about achievement and no \n \nPage 5 \n• Psychotherapy • Research • Training \nC C I\n\n[Doc 2 — Procrastination & Emotion Regulation | topic: procrastination]\nconsequences for oneself and others for doing so [1,2]. Yet, the harms from procrastination\nare not limited to those involving productivity. Research over the past two decades has\ndocumented that procrastination can also have wide-ranging and negative consequences\nfor health and well-being [3], especially when it becomes a chronic behavioural pattern.\nFor example, procrastination is associated with higher stress [ 4–9], use of less adaptive\ncoping strategies [10], poor health behaviours [5,9,11–13], poor quality sleep [14,15], poor\n\n[Doc 3 — Procrastination & Emotion Regulation | topic: procrastination]\nindividual differences in self-regulatory capacities, and speciﬁcally emotion regulation\nweaknesses, this new framework suggests that culpability for procrastination does not\nsolely or always rest within the individual. Instead, this view of procrastination suggests\nthat there also needs to be consideration of any ongoing stressful circumstances that\nmight make mood regulation more challenging, and therefore increase vulnerability for\nprocrastination. Taking such stressful contexts into account can help identify when and\n\n[Doc 4 — Procrastination & Emotion Regulation | topic: procrastination]\n2016, 11, e0148054. [CrossRef]\n9. Johansson, F.; Rozental, A.; Edlund, K.; C ôté, P .; Sundberg, T.; Onell, C.; Rudman, A.; Skillgate, E. Associations between\nProcrastination and Subsequent Health Outcomes Among University Students in Sweden. JAMA Netw. Open 2023, 6, e2249346.\n[CrossRef]\n10. Sirois, F.M.; Kitner, R. Less adaptive or more maladaptive? A meta-analytic investigation of procrastination and coping. Eur. J.\nPersonal. 2015, 29, 433–444. [CrossRef]\n\n[Doc 5 — Getting Things Done (GTD) | topic: habit]\nBut surrendering to your inner awareness, and its intelligence and advice for\nthe worlds you live in, is the higher ground. Trusting yourself and the source\nof your intelligence is the most elegant version of experiencing freedom and\nmanifesting personal productivity.\n*In an ideal world, you could see all your next-action reminders any way\nyou wanted to see them: time, brain-power, location, or tool required;\nemotional payoff; area of life served; goals and projects supported.\nThe issue is: How much structure is too much, for the potential value of it? If']",I don't have enough research in my knowledge base to answer that specifically.,0.0,0.0,v1_dense_only
What is implementation intention and how does it reduce procrastination?,"['[Doc 1 — Atomic Habits | topic: habit]\nGive your habits a time and a space to live in the world. The goal is to make\nthe time and location so obvious that, with enough repetition, you get an urge to\ndo the right thing at the right time, even if you can’t say why. As the \nwriter\nJason Zweig noted, “Obviously you’re never going to just work out without\nconscious thought. But like a dog salivating at a bell, maybe you start to get\nantsy around the time of day you normally work out.”\nThere are \nmany ways to use implementation intentions in your life and work.\n\n[Doc 2 — Procrastination & Emotion Regulation | topic: procrastination]\nconsequences for oneself and others for doing so [1,2]. Yet, the harms from procrastination\nare not limited to those involving productivity. Research over the past two decades has\ndocumented that procrastination can also have wide-ranging and negative consequences\nfor health and well-being [3], especially when it becomes a chronic behavioural pattern.\nFor example, procrastination is associated with higher stress [ 4–9], use of less adaptive\ncoping strategies [10], poor health behaviours [5,9,11–13], poor quality sleep [14,15], poor\n\n[Doc 3 — Getting Things Done (GTD) | topic: habit]\npower of, 271–72\nprinciples in, 60, 68–69\npurpose in, 60, 65–68\nsteps in, 229–30\nsupport structures for, 234–38\ntips and techniques for, 227–39\ntools for, 231–34\nvision/outcome in, 56, 60, 61, 65, 69–72, 201, 215–19, 222–23\nwhat projects to plan, 228–31\nsee also projects\npositive psychology, 276–77\nPost-its, 93\nprinciples, 60, 68–69\nin Horizon 5, 56–57, 201, 215–19, 222–23\npriorities, 210, 225–26\nproblems, 163, 273, 294–95\nprocess, meaning of, 124\nprocrastination, 257–61\nproductivity, 13, 253, 267, 273\nnext-action decision-making standard and, 263\n\n[Doc 4 — CBT for Procrastination | topic: procrastination]\ntime” or “I don’t deserve rewards or fun”. But think of it this way, the things you don’t like doing tend to \nzap some of your energy, whereas rewards, leisure and pleasure help replenish you energy, allowing you to \ndo better quality work in the long run. It is all about a balance between pleasure and achievement. When \nyou are a procrastinator the balance is out, in that there is more pleasure (often guilty pleasure) and little \nachievement. The aim with overcoming procrastination is not for it to be all about achievement and no \n \nPage 5 \n• Psychotherapy • Research • Training \nC C I\n\n[Doc 5 — CBT for Procrastination | topic: procrastination]\nWilkinson. \nBurka, J.B., & Yuen, L.M. (1983). Procrastination: Why You Do It, What To Do About It. US: DaCapo Press. \nEllis, A., & Knaus, W.J. (1977). Overcoming Procrastination. New York: Signet. \nFiore, N. (1989). The Now Habit: A Strategic Program For Overcoming Procrastination And Enjoying Guilt-Free \nPlay. New York: Penguin Group. \nKnaus, W.J. (1979). Do It Now: How To Stop Procrastinating. New Jersey: Prentice-Hall Inc. \nKnaus, W. (2002). The Procrastination Workbook: Your Personalized Program For Breaking Free From The']",I don't have enough research in my knowledge base to answer that specifically.,0.0,0.0,v1_dense_only
How does self-compassion help with chronic procrastination?,"['[Doc 1 — Procrastination & Emotion Regulation | topic: procrastination]\nconsequences for oneself and others for doing so [1,2]. Yet, the harms from procrastination\nare not limited to those involving productivity. Research over the past two decades has\ndocumented that procrastination can also have wide-ranging and negative consequences\nfor health and well-being [3], especially when it becomes a chronic behavioural pattern.\nFor example, procrastination is associated with higher stress [ 4–9], use of less adaptive\ncoping strategies [10], poor health behaviours [5,9,11–13], poor quality sleep [14,15], poor\n\n[Doc 2 — Procrastination & Emotion Regulation | topic: procrastination]\nindividual differences in self-regulatory capacities, and speciﬁcally emotion regulation\nweaknesses, this new framework suggests that culpability for procrastination does not\nsolely or always rest within the individual. Instead, this view of procrastination suggests\nthat there also needs to be consideration of any ongoing stressful circumstances that\nmight make mood regulation more challenging, and therefore increase vulnerability for\nprocrastination. Taking such stressful contexts into account can help identify when and\n\n[Doc 3 — Procrastination & Emotion Regulation | topic: procrastination]\nthey may have increased vulnerability for procrastination. After discussing potential applications\nof the new model for understanding how and why risk for procrastination may increase in other\nstressful contexts, approaches that might mitigate vulnerability for procrastination in high-stress\ncontexts are discussed. Overall, this new stress context vulnerability model underscores the need\nfor taking a more compassionate view of the antecedents and factors that may increase the risk\nfor procrastination.\nKeywords: procrastination; stress; COVID-19; personality; emotion regulation; coping\n\n[Doc 4 — Procrastination & Emotion Regulation | topic: procrastination]\n2016, 11, e0148054. [CrossRef]\n9. Johansson, F.; Rozental, A.; Edlund, K.; C ôté, P .; Sundberg, T.; Onell, C.; Rudman, A.; Skillgate, E. Associations between\nProcrastination and Subsequent Health Outcomes Among University Students in Sweden. JAMA Netw. Open 2023, 6, e2249346.\n[CrossRef]\n10. Sirois, F.M.; Kitner, R. Less adaptive or more maladaptive? A meta-analytic investigation of procrastination and coping. Eur. J.\nPersonal. 2015, 29, 433–444. [CrossRef]\n\n[Doc 5 — Self-Compassion & Productivity | topic: procrastination]\n(Lloyd et al. 2019 ). Among professional caregivers such as therapists, doctors, nurses, educators,\nand first responders, greater self-compassion is associated with greater compassion satisfaction\n(the positive feelings experienced from one’ s work) as well as less caregiver fatigue, burnout, and\nstress (e.g., Babenko et al. 2019, Kotera et al. 2021, McDonald et al. 2021). Far from being selfish,\ngiving oneself compassion provides the emotional resources needed to care for others.\nwww.annualreviews.org \x0f Self-Compassion 203']",I don't have enough research in my knowledge base to answer that specifically.,0.0,0.0,v1_dense_only
What are CBT strategies I can use when I'm stuck and can't start?,"['[Doc 1 — Implementation Intentions | topic: procrastination]\nI want to emphasize that not all tips or tricks fit for \neveryone. In fact, a quick internet search will turn up \ndirectly conflicting advice (e.g., start with the most dreaded \ntask to get it over with vs. start with a smaller, more manageable \ntask to get warmed up). This highlights how important it is \nfor you to be able to take ownership of this process by \nfiguring out what works for you and leaving the rest. I \nhave provided several different suggestions below in the\n\n[Doc 2 — Getting Things Done (GTD) | topic: habit]\nleaving nothing on your mind other than what’s present in the moment.\nConclusion\nI hope this book has been useful—that you have started to reap the rewards\nof getting more done with less effort and stress. And I really hope you have\ntasted the freedom of a “mind like water” and the release of your creative\nenergies that can be the result of the application of these techniques. Those\nwho begin to implement GTD methods always discover there’s more here\nthan meets the eye, and you may have already begun to experience your own\nversion of that.\n\n[Doc 3 — Getting Things Done (GTD) | topic: habit]\nrelevant project plans, support materials, and any other work-in-progress\nmaterial to trigger new actions, completions, waiting-fors, etc.\nReview Any Relevant Checklists Is there anything else that you haven’t done,\nthat you need or want to do, given your various engagements, interests, and\nresponsibilities?\nGet Creative\nThis methodology is not simply about cleaning up and getting closure. Those\nare critical factors, to be sure, to utilize for clarity and focus. Ultimately,\nthough, the prime driver for my own exploration in this field has been\n\n[Doc 4 — CBT for Procrastination | topic: procrastination]\n• When contemplating how to do a task, there are numerous ways you can approach any given task to \nmake the task easier. Some of the methods you might try include, worst-first, using momentum, just 5-\nminutes, set time limits, prime time, prime place, remember-then-do, reminders, visualise, focus, and \nplan rewards. \n• To manage your time availability, so that you know when to do your tasks and goals, you can use a \nmore fixed method like the schedule (i.e., planning specific tasks for specific times in your week) or a\n\n[Doc 5 — Getting Things Done (GTD) | topic: habit]\nChapter 5: Capturing: Corralling Your “Stuff”\nChapter 6: Clarifying: Getting “In” to Empty\nChapter 7: Organizing: Setting Up the Right Buckets\nChapter 8: Reflecting: Keeping It All Fresh and Functional\nChapter 9: Engaging: Making the Best Action Choices\nChapter 10: Getting Projects Under Control\npart 3: The Power of the Key Principles\nChapter 11: The Power of the Capturing Habit\nChapter 12: The Power of the Next-Action Decision\nChapter 13: The Power of Outcome Focusing\nChapter 14: GTD and Cognitive Science\nChapter 15: The Path of GTD Mastery\nConclusion\nAppendix']","I understand how tough it can be to get started when you're feeling stuck. Here are some Cognitive Behavioral Therapy (CBT) strategies you can use right now to help you initiate tasks:

1. **Just 5 Minutes**: Commit to working on your task for just five minutes. This small time frame can help reduce the pressure of starting and often leads to continued work once you've begun.

2. **Visualize Success**: Take a moment to visualize completing the task. Picture how you will feel once it’s done and the benefits that will come from completing it. This can help motivate you to start.

3. **Set a Timer**: Use a timer to create a sense of urgency. Set it for 10-15 minutes and focus solely on the task during that time. Knowing there's a limit can make starting feel less daunting.

4. **Plan Rewards**: Give yourself something to look forward to after completing the task. It could be a short break, a snack, or some time on your phone. This can create a positive association with task completion.

5. **Focus on the Next Action**: Instead of thinking about the entire task, identify the very next action you need to take. This could be as simple as opening a document or gathering materials. Focusing on one small step can make it easier to start.

Try one or more of these strategies for the next few minutes, and see if they help you break through that barrier. You've got this! 

Sources: [Doc 4]",0.6666666666666666,0.9153777015929491,v1_dense_only
What is the role of emotion regulation in procrastination?,"['[Doc 1 — Procrastination & Emotion Regulation | topic: procrastination]\nindividual differences in self-regulatory capacities, and speciﬁcally emotion regulation\nweaknesses, this new framework suggests that culpability for procrastination does not\nsolely or always rest within the individual. Instead, this view of procrastination suggests\nthat there also needs to be consideration of any ongoing stressful circumstances that\nmight make mood regulation more challenging, and therefore increase vulnerability for\nprocrastination. Taking such stressful contexts into account can help identify when and\n\n[Doc 2 — Implementation Intentions | topic: procrastination]\nresponsible for self-regulation, including emotional \nregulation (Boysan & Kiral, 2016; Schouwenburg \n& Lay , 1995). There is evidence that those who are \nhigh in conscientiousness are able to avoid falling \ninto the trap of procrastination partially due to their \nability to structure their environment to set them up \nfor more likely success, a strategy even those low in \nconscientiousness can learn to emulate. Along these \nlines, teaching students emotion regulation skills was \nfound to significantly reduce procrastination (Eckert et\n\n[Doc 3 — Procrastination & Emotion Regulation | topic: procrastination]\nemotions may therefore be lowered due to this cumulative effect. Accordingly, vulnerability\nfor procrastinating tasks that might not normally be procrastinated increases, especially\namong individuals who are already prone to procrastination and are using task avoidance\nas a habitual means to regulate difﬁcult emotions [19]. In this respect, stressful contexts\ncreate an environment that increases vulnerability for the phenotypic expression of trait\nprocrastination.\nHigh-stress contexts may also contribute to lowered tolerance for negative states\n\n[Doc 4 — Procrastination & Emotion Regulation | topic: procrastination]\ncognitively demanding [46]. However, there is a trade-off of between resource costs and \neffectiveness. Strategies such as c ognitive reappraisal provide more effective and longer \nlasting regulation of negative emotions [37]. \nFigure 1. Stress context vulnerability model of procrastination. Note: High-stress contexts are proposed\n\n[Doc 5 — Procrastination & Emotion Regulation | topic: procrastination]\nconsequences for oneself and others for doing so [1,2]. Yet, the harms from procrastination\nare not limited to those involving productivity. Research over the past two decades has\ndocumented that procrastination can also have wide-ranging and negative consequences\nfor health and well-being [3], especially when it becomes a chronic behavioural pattern.\nFor example, procrastination is associated with higher stress [ 4–9], use of less adaptive\ncoping strategies [10], poor health behaviours [5,9,11–13], poor quality sleep [14,15], poor']",I don't have enough research in my knowledge base to answer that specifically.,0.0,0.0,v1_dense_only
How does poor sleep affect my ability to focus the next day?,"['[Doc 1 — Sleep & Cognitive Performance | topic: sleep]\nand on self-reported anxiety. Brain Cogn, 60:76–87.\nSamkoff JS, Jacques CH. 1991. A review of studies concerning effects of \nsleep deprivation and fatigue on residents’ performance. Acad Med, \n66:687–93.\nSarter M, Gehring WJ, Kozak R. 2006. More attention must be paid: The neu-\nrobiology of attentional effort. Brain Res Brain Res Rev, 51:145–60.\nScoville WB, Milner B. 2000. Loss of recent memory after bilateral hippo-\ncampal lesions. 1957. J Neuropsychiatry Clin Neurosci, 12:103–13.\nShneerson JM. 2000. Handbook of sleep medicine. Cambridge: Blackwell \nScience.\n\n[Doc 2 — Sleep & Cognitive Performance | topic: sleep]\nRinkenauer G, Osman A, Ulrich R, et al 2004. On the locus of speed-accu-\nracy trade-off in reaction time: Inferences from the lateralized readiness \npotential. J Exp Psychol Gen, 133:261–82.\nRusso MB, Kendall AP, Johnson DE, et al 2005. Visual perception, psy-\nchomotor performance, and complex motor performance during an \novernight air refueling simulated ﬂ ight. Aviat Space Environ Med , \n76:C92–103.\nSagaspe P, Sanchez-Ortuno M, Charles A, et al 2006. Effects of sleep \ndeprivation on color-word, emotional, and speciﬁ c stroop interference \nand on self-reported anxiety. Brain Cogn, 60:76–87.\n\n[Doc 3 — Sleep & Cognitive Performance | topic: sleep]\net al 2004), which could leave older subjects more alert. \nThere is also evidence that aging subjects recover faster \nfrom SD than young subjects in terms of physiological sleep \n(Bonnet and Rosa 1987; Brendel et al 1990). This faster \nrecovery in sleep state may also mean better restoration of \ncognitive performance (Bonnet and Rosa 1987; Brendel \net al 1990). However, more research is necessary to conﬁ rm \nthese hypotheses.\n\n[Doc 4 — Sleep & Cognitive Performance | topic: sleep]\non lateral visual attention. Int J Neurosci, 116:1125–38.\nKilduff TS, Kushida CA, Terao A. 2005. Recovery from sleep deprivation. \nNew Y ork: Marcel Dekker. p. 485–502.\nKillgore WD, Balkin TJ, Wesensten NJ. 2006. Impaired decision making \nfollowing 49 h of sleep deprivation. J Sleep Res, 15:7–13.\nKim DJ, Lee HP, Kim MS, et al. 2001. The effect of total sleep deprivation \non cognitive functions in normal adult male subjects. Int J Neurosci, \n109:127–37.\nKimura D. 1996. Sex, sexual orientation and sex hormones inﬂ uence human \ncognitive function. Curr Opin Neurobiol, 6:259–63.\n\n[Doc 5 — Body Recomposition Research | topic: nutrition]\nare susceptible, may alleviate some of the related feelings\nof anxiety with caffeine use. Given that anxiety may dis-\nrupt concentration and sleep and negatively impact so-\ncial interactions, athletes with higher risks and\nprevalence for anxiety, may want to limit or avoid caf-\nfeine consumption (if caffeine is a known trigger) during\ntimes where they are feeling anxious or stressed, such as\nat sporting competitions or social gatherings or other\nwork and school events.\nThe importance of both sleep and caffeine (as an ergo-\ngenic aid) to athletes highlights the importance of opti-']",I don't have enough research in my knowledge base to answer that specifically.,0.0,0.0,v1_dense_only
What time of day is my brain sharpest based on circadian rhythm research?,"['[Doc 1 — Circadian Rhythms & Performance | topic: sleep]\nonly 2 or 3 days off per month. This means, on average, about one game every day with frequently \nchanging game start times and varying game locations. The games start at different hours of the \nday, like noon, 13:00, 14:00, 15:00, 18:00, 19:00, 20:00, 21:00, and 22:00 (EST). These varying time \nconditions make it very challenging for players, coaches and trainers to optimally prepare for the \ngame and achieve peak performance throughout its duration. Unfortunately, this constant shifting \nof game times, game locations, and travel schedules desynchronizes the circadian timing mech -\n\n[Doc 2 — Sleep & Cognitive Performance | topic: sleep]\nRinkenauer G, Osman A, Ulrich R, et al 2004. On the locus of speed-accu-\nracy trade-off in reaction time: Inferences from the lateralized readiness \npotential. J Exp Psychol Gen, 133:261–82.\nRusso MB, Kendall AP, Johnson DE, et al 2005. Visual perception, psy-\nchomotor performance, and complex motor performance during an \novernight air refueling simulated ﬂ ight. Aviat Space Environ Med , \n76:C92–103.\nSagaspe P, Sanchez-Ortuno M, Charles A, et al 2006. Effects of sleep \ndeprivation on color-word, emotional, and speciﬁ c stroop interference \nand on self-reported anxiety. Brain Cogn, 60:76–87.\n\n[Doc 3 — Deep Work | topic: focus]\ncorresponding to the hour where I finished the result.\n*\n This served two purposes.\nFirst, it allowed me to connect, at a visceral level, accumulated deep work hours and\n\n[Doc 4 — Sleep & Cognitive Performance | topic: sleep]\net al 2004), which could leave older subjects more alert. \nThere is also evidence that aging subjects recover faster \nfrom SD than young subjects in terms of physiological sleep \n(Bonnet and Rosa 1987; Brendel et al 1990). This faster \nrecovery in sleep state may also mean better restoration of \ncognitive performance (Bonnet and Rosa 1987; Brendel \net al 1990). However, more research is necessary to conﬁ rm \nthese hypotheses.\n\n[Doc 5 — Sleep & Cognitive Performance | topic: sleep]\non lateral visual attention. Int J Neurosci, 116:1125–38.\nKilduff TS, Kushida CA, Terao A. 2005. Recovery from sleep deprivation. \nNew Y ork: Marcel Dekker. p. 485–502.\nKillgore WD, Balkin TJ, Wesensten NJ. 2006. Impaired decision making \nfollowing 49 h of sleep deprivation. J Sleep Res, 15:7–13.\nKim DJ, Lee HP, Kim MS, et al. 2001. The effect of total sleep deprivation \non cognitive functions in normal adult male subjects. Int J Neurosci, \n109:127–37.\nKimura D. 1996. Sex, sexual orientation and sex hormones inﬂ uence human \ncognitive function. Curr Opin Neurobiol, 6:259–63.']",I don't have enough research in my knowledge base to answer that specifically.,1.0,0.0,v1_dense_only
