user_input,retrieved_contexts,response,faithfulness,answer_relevancy,version
What sleep hygiene habits have the strongest evidence behind them?,"['[Doc 1 — Sleep Hygiene Guidelines | topic: sleep]\nhttps://pubmed.ncbi.nlm.nih.gov/23211256/\n\nNational Institutes of Health (NIH). (2012, January). NIH News in Health: Breaking Bad Habits.\n\nhttps://newsinhealth.nih.gov/2012/01/breaking-bad-habits\n\nIrish, L. A., Kline, C. E., Gunn, H. E., Buysse, D. J., & Hall, M. H. (2015). The role of sleep hygiene in promoting public health: A review of empirical evidence. Sleep Medicine Reviews, 22, 23–36.\n\nhttps://pubmed.ncbi.nlm.nih.gov/25454674/\n\n[Doc 2 — Atomic Habits | topic: habit]\nsleeping . . . was the only action that happened in that room\n “Techniques involving stimulus control have even been successfully used to help people with insomnia. In short, those who had trouble\nfalling asleep were told to only go to their room and lie in their bed when they were tired. If they couldn’t fall asleep, they were told to get up and change rooms. Strange advice, but over\ntime, researchers found that by associating the bed with ‘It’s time to go to sleep’ and not with other activities (reading a book, just lying there, etc.), participants were eventually able to\n\n[Doc 3 — Sleep & Cognitive Performance | topic: sleep]\nand on self-reported anxiety. Brain Cogn, 60:76–87.\nSamkoff JS, Jacques CH. 1991. A review of studies concerning effects of \nsleep deprivation and fatigue on residents’ performance. Acad Med, \n66:687–93.\nSarter M, Gehring WJ, Kozak R. 2006. More attention must be paid: The neu-\nrobiology of attentional effort. Brain Res Brain Res Rev, 51:145–60.\nScoville WB, Milner B. 2000. Loss of recent memory after bilateral hippo-\ncampal lesions. 1957. J Neuropsychiatry Clin Neurosci, 12:103–13.\nShneerson JM. 2000. Handbook of sleep medicine. Cambridge: Blackwell \nScience.\n\n[Doc 4 — Sleep & Cognitive Performance | topic: sleep]\non lateral visual attention. Int J Neurosci, 116:1125–38.\nKilduff TS, Kushida CA, Terao A. 2005. Recovery from sleep deprivation. \nNew Y ork: Marcel Dekker. p. 485–502.\nKillgore WD, Balkin TJ, Wesensten NJ. 2006. Impaired decision making \nfollowing 49 h of sleep deprivation. J Sleep Res, 15:7–13.\nKim DJ, Lee HP, Kim MS, et al. 2001. The effect of total sleep deprivation \non cognitive functions in normal adult male subjects. Int J Neurosci, \n109:127–37.\nKimura D. 1996. Sex, sexual orientation and sex hormones inﬂ uence human \ncognitive function. Curr Opin Neurobiol, 6:259–63.\n\n[Doc 5 — Atomic Habits | topic: habit]\nFIGURE 7: Habit stacking increases the likelihood that you’ll stick with a habit by stacking your new behavior on top of an old one. This process can be repeated to chain numerous habits\ntogether, each one acting as the cue for the next.\nYour morning routine habit stack might look like this:\n1. \nAfter I pour my morning cup of coffee, I will meditate for sixty\nseconds.\n2. \nAfter I meditate for sixty seconds, I will write my to-do list for the\nday.\n3. \nAfter I write my to-do list for the day, I will immediately begin my\nfirst task.\nOr, consider this habit stack in the evening:']",I don't have enough research in my knowledge base to answer that specifically.,0.0,0.0,v1_dense_only
How many hours of sleep do I need to maintain cognitive performance?,"['[Doc 1 — Sleep & Cognitive Performance | topic: sleep]\net al 2004), which could leave older subjects more alert. \nThere is also evidence that aging subjects recover faster \nfrom SD than young subjects in terms of physiological sleep \n(Bonnet and Rosa 1987; Brendel et al 1990). This faster \nrecovery in sleep state may also mean better restoration of \ncognitive performance (Bonnet and Rosa 1987; Brendel \net al 1990). However, more research is necessary to conﬁ rm \nthese hypotheses.\n\n[Doc 2 — Sleep & Cognitive Performance | topic: sleep]\nRinkenauer G, Osman A, Ulrich R, et al 2004. On the locus of speed-accu-\nracy trade-off in reaction time: Inferences from the lateralized readiness \npotential. J Exp Psychol Gen, 133:261–82.\nRusso MB, Kendall AP, Johnson DE, et al 2005. Visual perception, psy-\nchomotor performance, and complex motor performance during an \novernight air refueling simulated ﬂ ight. Aviat Space Environ Med , \n76:C92–103.\nSagaspe P, Sanchez-Ortuno M, Charles A, et al 2006. Effects of sleep \ndeprivation on color-word, emotional, and speciﬁ c stroop interference \nand on self-reported anxiety. Brain Cogn, 60:76–87.\n\n[Doc 3 — Sleep & Cognitive Performance | topic: sleep]\nand on self-reported anxiety. Brain Cogn, 60:76–87.\nSamkoff JS, Jacques CH. 1991. A review of studies concerning effects of \nsleep deprivation and fatigue on residents’ performance. Acad Med, \n66:687–93.\nSarter M, Gehring WJ, Kozak R. 2006. More attention must be paid: The neu-\nrobiology of attentional effort. Brain Res Brain Res Rev, 51:145–60.\nScoville WB, Milner B. 2000. Loss of recent memory after bilateral hippo-\ncampal lesions. 1957. J Neuropsychiatry Clin Neurosci, 12:103–13.\nShneerson JM. 2000. Handbook of sleep medicine. Cambridge: Blackwell \nScience.\n\n[Doc 4 — Sleep & Cognitive Performance | topic: sleep]\ntrait-like vulnerability.\nAcute total sleep deprivation\nAttention and working memory\nThe two most widely studied cognitive domains in SD \nresearch are attention and working memory, which in fact \nare interrelated. Working memory can be divided into four \nsubsystems: phonological loop, visuospatial sketchpad, \nepisodic buffer and central executive (Baddeley and Hitch \n1974; Baddeley 2000). The phonological loop is assumed \nto temporarily store verbal and acoustic information (echo \nmemory); the sketchpad, to hold visuospatial information\n\n[Doc 5 — Sleep & Cognitive Performance | topic: sleep]\non lateral visual attention. Int J Neurosci, 116:1125–38.\nKilduff TS, Kushida CA, Terao A. 2005. Recovery from sleep deprivation. \nNew Y ork: Marcel Dekker. p. 485–502.\nKillgore WD, Balkin TJ, Wesensten NJ. 2006. Impaired decision making \nfollowing 49 h of sleep deprivation. J Sleep Res, 15:7–13.\nKim DJ, Lee HP, Kim MS, et al. 2001. The effect of total sleep deprivation \non cognitive functions in normal adult male subjects. Int J Neurosci, \n109:127–37.\nKimura D. 1996. Sex, sexual orientation and sex hormones inﬂ uence human \ncognitive function. Curr Opin Neurobiol, 6:259–63.']",I don't have enough research in my knowledge base to answer that specifically.,0.5,0.0,v1_dense_only
What should I eat in the morning to optimize focus?,"['[Doc 1 — Protein & Nutrient Timing | topic: nutrition]\nbody composition or performance between the morning\nand evening casein supplementation groups. A potential\nexplanation for the lack of findings might stem from the\nalready high intake of protein by the study participants be-\nfore the study commenced. However, it is worth noting\nthat although not statistically significant, the morning\ngroup added 0.4 kg of lean body mass compared to 1.2 kg\nin the evening group even though the habitual diet of the\ntrained subjects in this study was reported to be 1.7 to\n1.9 g/kg/day of protein. Thus, it appears that protein con-\n\n[Doc 2 — Protein & Nutrient Timing | topic: nutrition]\nably, Coyle et al. [19] reported that consumption of a\nhigh-carbohydrate meal 4 h before 105 min of cycling ex-\nercise at 70% VO 2max after an overnight fast significantly\nincreased both muscle and liver glycogen while also in-\ncreasing rates of carbohydrate oxidation and utilization of\nmuscle glycogen. In addition to increasing stored glyco-\ngen, other studies have reported significant improvements\nin aerobic exercise performance [37 –39]. However, not all\nstudies have demonstrated a performance-enhancing ef-\nfect. Nonetheless, it is commonly recommended to con-\n\n[Doc 3 — Body Recomposition Research | topic: nutrition]\nare susceptible, may alleviate some of the related feelings\nof anxiety with caffeine use. Given that anxiety may dis-\nrupt concentration and sleep and negatively impact so-\ncial interactions, athletes with higher risks and\nprevalence for anxiety, may want to limit or avoid caf-\nfeine consumption (if caffeine is a known trigger) during\ntimes where they are feeling anxious or stressed, such as\nat sporting competitions or social gatherings or other\nwork and school events.\nThe importance of both sleep and caffeine (as an ergo-\ngenic aid) to athletes highlights the importance of opti-\n\n[Doc 4 — Protein & Nutrient Timing | topic: nutrition]\na) aggressive carbohydrate refeeding (1.2 g/kg/h) with a preference towards carbohydrate sources that have a\nhigh (> 70) glycemic index\nb) the addition of caffeine (3–8m g / k g )\nc) combining carbohydrates (0.8 g/kg/h) with protein (0.2–0.4 g/kg/h)\n4. Extended (> 60 min) bouts of high intensity (> 70% VO 2max) exercise challenge fuel supply and fluid regulation,\nthus carbohydrate should be consumed at a rate of ~30 –60 g of carbohydrate/h in a 6 –8% carbohydrate-\nelectrolyte solution (6–12 fluid ounces) every 10 –15 min throughout the entire exercise bout, particularly in those\n\n[Doc 5 — Body Recomposition Research | topic: nutrition]\nwakefulness. Aviat Space Environ Med. 2004;75(9):771 –6.\n336. Share B, Sanders N, Kemp J. Caffeine and performance in clay target\nshooting. J Sports Sci. 2009;27(6):661 –6.\n337. Pomportes L, Brisswalter J, Hays A, Davranche K. Effects of Carbohydrate,\nCaffeine, and Guarana on Cognitive Performance, Perceived Exertion, and\nShooting Performance in High-Level Athletes. Int J Sports Physiol Perform.\n2019;14(5):576–82.\n338. Duncan MJ, Dobell AP, Caygill CL, Eyre E, Tallis J. The effect of acute caffeine\ningestion on upper body anaerobic exercise and cognitive performance. Eur']",I don't have enough research in my knowledge base to answer that specifically.,0.0,0.0,v1_dense_only
How does cortisol affect my energy levels and body composition?,"['[Doc 1 — Body Recomposition Research | topic: nutrition]\nintensity training in athletes [ 322, 323]. Chronic mild to\nmoderate sleep deprivation in athletes, potentially attrib-\nuted to caffeine intakes, may result in negative or altered\nimpacts on glucose metabolism, neuroendocrine func-\ntion, appetite, food intake and protein synthesis, as well\nas attention, learning and memory [ 323]. These factors\ncan all influence an athlete ’ s nutritional, metabolic, and\nendocrine status negatively and hence potentially affect\nenergy levels, muscle repair, immunity, body compos-\nition, memory and learning and result in diminished ath-\n\n[Doc 2 — Body Recomposition Research | topic: nutrition]\nA, Williams S, dos Santos MG. A commercially available energy drinkdoes\nnot improve peak power production on multiple 20-second Wingate tests. J\nInt Soc Sports Nutr. 2010;7(1):1 –2.\n102. Hoffman JR, Kang J, Ratamess NA, Hoffman MW, Tranchina CP, Faigenbaum\nAD. Examination of a pre-exercise, high energy supplement on exercise\nperformance. J Int Soc Sports Nutr. 2009;6(1):2.\n103. Seidl R, Peyrl A, Nicham R, Hauser E. A taurine and caffeine-containing drink\nstimulates cognitive performance and well-being. Amino Acids. 2000.\n\n[Doc 3 — Protein & Nutrient Timing | topic: nutrition]\nchanges in body composition were determined by dual-\nenergy x-ray absorptiometry (DEXA), which does not\nhave the same sensitivity to identify subtle hypertrophic\nalterations [111] as the histochemical approaches\nemployed by Andersen et al. [109]. Finally, the study\nparticipants in the Andersen et al. study were consuming\napproximately 20% more calories per day (~ 36.6 kcals/\nkg/day) than the participants in the Hoffman study (who\nconsumed only 30.4 kcals/kg/day) which offers some\nlevel of explanation for the different outcomes reported\nin these two studies. More recently, Schoenfeld and col-\n\n[Doc 4 — Body Recomposition Research | topic: nutrition]\ncluded that caffeine increased running time by delaying\nfatigue through CNS effects, in part by blocking adeno-\nsine receptors [ 191]. Caffeine also appears to enhance\ncognitive performance more in fatigued than well-rested\nsubjects [ 192– 194]. This phenomenon is also apparent\nin exercise performance [ 195] both in the field [ 196] and\nin the lab [ 60, 63, 149].\nThe placebo effect\nThe placebo effect is a beneficial outcome that cannot\nbe attributed to a treatment or intervention but is\nbrought about by the belief that one has received a posi-\n\n[Doc 5 — Cortisol, Stress & Body Composition | topic: nutrition]\nrisk of hypertension, diabetes, dyslipidemia, and metabolic syndrome when compared to\nnormal waist circumference values.1–3 In women, higher levels of androgens and cortisol\nseem to be associated with increased abdominal fat.1 Furthermore, increased abdominal fat\nhas been shown to be associated with poor coping with stress, including sick leave,\npsychological maladjustments, psychosomatic and psychiatric disease.1 For women in\nparticular, increasing waist-hip ratio, a measure of abdominal fat distribution, is associated']",I don't have enough research in my knowledge base to answer that specifically.,0.0,0.0,v1_dense_only
What is protein timing and why does it matter for performance?,"['[Doc 1 — Protein & Nutrient Timing | topic: nutrition]\nTraining In Healthy Young Men. J Nutr. 2015;145(6):1178 –84.\n175. Antonio J, Ellerbroek A, Peacock C, Silver T. Casein Protein Supplementation\nIn Trained Men And Women: Morning Versus Evening. Int J Exerc Sci. 2017;\n10(3):479–86.\n• We accept pre-submission inquiries \n\x81 Our selector tool helps you to ﬁnd the most relevant journal\n\x81 We provide round the clock customer support \n\x81 Convenient online submission\n\x81 Thorough peer review\n\x81 Inclusion in PubMed and all major indexing services \n\x81 Maximum visibility for your research\nSubmit your manuscript at\nwww.biomedcentral.com/submit\n\n[Doc 2 — Protein & Nutrient Timing | topic: nutrition]\nbody composition or performance between the morning\nand evening casein supplementation groups. A potential\nexplanation for the lack of findings might stem from the\nalready high intake of protein by the study participants be-\nfore the study commenced. However, it is worth noting\nthat although not statistically significant, the morning\ngroup added 0.4 kg of lean body mass compared to 1.2 kg\nin the evening group even though the habitual diet of the\ntrained subjects in this study was reported to be 1.7 to\n1.9 g/kg/day of protein. Thus, it appears that protein con-\n\n[Doc 3 — Protein & Nutrient Timing | topic: nutrition]\ntotal dose of protein over a 12-h measurement period\nfollowing a bout of lower body resistance exercise. One\nof the protein feeding patterns required participants to\nconsume two 40-g doses of whey protein isolate ap-\nproximately 6 h apart. Another condition required the\nconsumption of four, 20-g doses of whey protein isolate\nevery 3 h. The final condition required the participants\nto consume eight, 10-g doses of whey protein isolate\nevery 90 min. Rates of muscle protein turnover, synthe-\nsis, and breakdown were compared, and the authors\nconcluded that protein turnover and synthesis rates were\n\n[Doc 4 — Protein & Nutrient Timing | topic: nutrition]\nis less established.\n/C15Rapid ingestion of high amounts of carbohydrates\n(≥ 1.2 g/kg/h) for four to 6 h soon after exhausting\nexercise can rapidly stimulate replenishment of\nmuscle glycogen.\n/C15Adding protein (0.2 –0.5 g/kg/h) to carbohydrate\nincreases the rate of glycogen resynthesis when\ningesting < 1.2 g/kg/h of carbohydrate. Moreover,\nthe additional protein may minimize muscle\ndamage, promote favorable hormone balance and\naccelerate recovery from intense exercise.\n/C15For athletes completing high volumes (i.e., ≥ 8h )o f\nexercise per week and subsequently requiring the\n\n[Doc 5 — Protein & Nutrient Timing | topic: nutrition]\n27. Van Loon L, Saris WH, Kruijshoop M. Maximizing Postexercise Muscle Glycogen\nSynthesis: Carbohydrate Supplementation And The Application Of Amino Acid\nOr Protein Hydrolysate Mixtures. Am J Clin Nutr. 2000;72:106–11.\n28. Riddell MC, Partington SL, Stupka N, Armstrong D, Rennie C, Tarnopolsky\nMA. Substrate Utilization During Exercise Performed With And Without\nGlucose Ingestion In Female And Male Endurance Trained Athletes. Int J\nSport Nutr Exerc Metab. 2003;13(4):407 –21.\n29. Devries MC, Hamadeh MJ, Phillips SM, Tarnopolsky MA. Menstrual Cycle']",I don't have enough research in my knowledge base to answer that specifically.,0.0,0.0,v1_dense_only
What does the research say about Rhodiola Rosea for stress and energy?,"[""[Doc 1 — Rhodiola Rosea Research | topic: supplement]\nEvidence-based\n\nRhodiola Rosea\n\nWritten by:\n\nBill Willis, Megan Michaux\n\nFact-checked\n\nby:\n\nNick Milazzo, Gregory Lopez\n\nLast Updated: December 15, 2025\n\nRhodiola rosea, often called “rhodiola” for short, is a plant in the genus Rhodiola that’s used as an herbal supplement with adaptogenic properties that help to provide general resistance to stress. Although its mechanisms of action are not completely understood, it is clear that rhodiola increases resilience to stress at both the cellular and systemic levels.\n\nBill Willis\n\nMegan Michaux\n\nNick Milazzo\n\nGregory Lopez\n\n[Doc 2 — Body Recomposition Research | topic: nutrition]\nmon species Coffea arabica (arabica coffee) and Coffea\ncanephora (robusta coffee) used for global coffee pro-\nduction. While coffee is commonly ingested by exercis-\ning individuals as part of their habitual diet, coffee is\nalso commonly consumed pre-exercise to improve en-\nergy levels, mood, and exercise performance [ 11, 40]. In-\ndeed, a recent review on coffee and endurance\nperformance, reported that that coffee providing be-\ntween 3 and 8.1 m/kg of caffeine may benefit endurance\nperformance, such as time trial performance or time to\nexhaustion [ 11]. To date, research has only examined\n\n[Doc 3 — Body Recomposition Research | topic: nutrition]\nA, Williams S, dos Santos MG. A commercially available energy drinkdoes\nnot improve peak power production on multiple 20-second Wingate tests. J\nInt Soc Sports Nutr. 2010;7(1):1 –2.\n102. Hoffman JR, Kang J, Ratamess NA, Hoffman MW, Tranchina CP, Faigenbaum\nAD. Examination of a pre-exercise, high energy supplement on exercise\nperformance. J Int Soc Sports Nutr. 2009;6(1):2.\n103. Seidl R, Peyrl A, Nicham R, Hauser E. A taurine and caffeine-containing drink\nstimulates cognitive performance and well-being. Amino Acids. 2000.\n\n[Doc 4 — Body Recomposition Research | topic: nutrition]\nare susceptible, may alleviate some of the related feelings\nof anxiety with caffeine use. Given that anxiety may dis-\nrupt concentration and sleep and negatively impact so-\ncial interactions, athletes with higher risks and\nprevalence for anxiety, may want to limit or avoid caf-\nfeine consumption (if caffeine is a known trigger) during\ntimes where they are feeling anxious or stressed, such as\nat sporting competitions or social gatherings or other\nwork and school events.\nThe importance of both sleep and caffeine (as an ergo-\ngenic aid) to athletes highlights the importance of opti-\n\n[Doc 5 — Body Recomposition Research | topic: nutrition]\ncaffeine on simulated time-trial performance are independent of fitness\nlevel. J Caffeine Res. 2011;1:179 –85.\n97. Campbell BI, Richmond JL, Dawes JJ. The effects of a commercial, pre-\nexercise energy drink supplement on power, muscular endurance, and\nrepeated sprint speed. Int J Exerc Sci. 2016;9(2):9.\n98. Eckerson JM, Bull AJ, Baechle TR, Fischer CA, O'Brien DC, Moore GA, et al.\nAcute ingestion of sugar-free red bull energy drink has no effect on upper\nbody strength and muscular endurance in resistance trained men. J\nStrength Cond Res. 2013;27(8):2248 –54.""]","Rhodiola Rosea is recognized for its adaptogenic properties, which help enhance resilience to stress at both cellular and systemic levels. While the exact mechanisms are not fully understood, it is clear that Rhodiola can support general resistance to stress, potentially improving energy levels and reducing fatigue. This makes it a useful supplement for those experiencing stress-related energy crashes. 

If you're feeling low on energy and struggling to start tasks, consider trying Rhodiola Rosea to help improve your stress response and boost your energy. 

Sources: [Doc 1]",0.5,0.9565540829074716,v1_dense_only
Should I take magnesium and what does research say about it?,"['[Doc 1 — Magnesium Creatine Omega-3 | topic: supplement]\nAdequate intake (AI) Reference: Institute of Medicine. Magnesium (chapter 6 of Dietary Reference Intakes for Calcium, Phosphorus, Magnesium, Vitamin D, and Fluoride. The National Academies Press. 1997. DOI: 10.17226/5776)\n\nMagnesium UL\n\nThe tolerable upper intake level (UL) for magnesium only includes magnesium obtained from dietary supplements and medications. Supplement doses exceeding the UL are more likely to cause adverse effects.\n\nAGE MALE FEMALE PREGNANT LACTATING 0–12 months — — — — 1–3 years 65 mg 65 mg — — 4–8 years 110 mg 110 mg — — >9 years 350 mg 350 mg 350 mg 350 mg\n\n[Doc 2 — Body Recomposition Research | topic: nutrition]\nancestry. Clin Pharmacol Ther. 2012;92(4):511 –9.\n134. Djordjevic N, Ghotbi R, Bertilsson L, Jankovic S, Aklillu E. Induction of\nCYP1A2 by heavy coffee consumption in Serbs and Swedes. Eur J Clin\nPharmacol. 2008;64(4):381 –5.\n135. Marks V, Kelly JF. Absorption of caffeine from tea, coffee, and coca cola.\nLancet. 1973;1(7807):827.\n136. Liguori A, Hughes JR, Grass JA. Absorption and subjective effects of caffeine\nfrom coffee, cola and capsules. Pharmacol Biochem Behav. 1997;58(3):721 –6.\n137. Shargel LYA. Applied biopharmaceutics and pharmacokinetics. 4th ed.\nStamford: Appleton and Lange; 1999.\n\n[Doc 3 — Protein & Nutrient Timing | topic: nutrition]\nchanges in body composition were determined by dual-\nenergy x-ray absorptiometry (DEXA), which does not\nhave the same sensitivity to identify subtle hypertrophic\nalterations [111] as the histochemical approaches\nemployed by Andersen et al. [109]. Finally, the study\nparticipants in the Andersen et al. study were consuming\napproximately 20% more calories per day (~ 36.6 kcals/\nkg/day) than the participants in the Hoffman study (who\nconsumed only 30.4 kcals/kg/day) which offers some\nlevel of explanation for the different outcomes reported\nin these two studies. More recently, Schoenfeld and col-\n\n[Doc 4 — Body Recomposition Research | topic: nutrition]\nchewing gum formulation was absorbed at a significantly\nfaster rate, the overall bioavailability was comparable to\nthe capsuled 100 and 200 mg caffeine dose groups.\nThese pharmacokinetic findings are useful for military\nand sport purposes, where there is a requirement for\nrapid and maintained stimulation over specific periods\nof time. Chewing gum may also be advantageous due to\nreduced digestive requirements, where absorption of caf-\nfeine in other forms (capsule, coffee etc.) may be hin-\ndered by diminished splanchnic blood flow during\n\n[Doc 5 — Body Recomposition Research | topic: nutrition]\n314, 368, 369]. Despite positive outcomes at sea level,\nminimal data exist on the ergogenic effects or side ef-\nfects of caffeine in conditions of hypoxia, likely due to\naccessibility of this environment or the prohibitive costs\nof artificial methods. To date, only four investigations\n(Table 3) have examined the effects of caffeine on exer-\ncise performance under hypoxic conditions [ 211, 370–\n372]. In an initial study by Berglund and colleagues\n[370], caffeine (6 mg/kg) significantly improved 21 km\ntime trial performance 2300 m above sea level in 14']",I don't have enough research in my knowledge base to answer that specifically.,0.0,0.0,v1_dense_only
